type,text,processed_text
comment,"I think this is a bad take. You can't compare this shows story to something like ""ignoring the elite in charge"" because twice the players were given the opportunity (and sang woo 3 times) to not play and leave this all behind. This is a decision they made, not the old man.

  
Once, the initial offer. Second after the vote and third at the very end. I think its okay to be mad at both sang woo's characteristics and the old man. They are both selfish people in their own way. In the sense of how the game is played, this makes sang woo a very strong person.",i think this is a bad take you cant compare this shows story to something like ignoring the elite in charge because twice the players were given the opportunity and sang woo 3 times to not play and leave this all behind this is a decision they made not the old man once the initial offer second after the vote and third at the very end i think its okay to be mad at both sang woos characteristics and the old man they are both selfish people in their own way in the sense of how the game is played this makes sang woo a very strong person
comment,"How many times is this same question going to get reposted? Lmao 
There’s like 6 common “hot takes” that are just recycled over and over again",how many times is this same question going to get reposted lmao there’s like 6 common “hot takes” that are just recycled over and over again
comment,"I think it’s likely that he was planning to just win the money for his mom and debts and he’d kill himself before going to prison. He was so ashamed that he told his mom he was on a business trip, and he was suicidal after they voted to quit. Even if he was formulating a plan to hire a good lawyer or go into hiding after he won, I do think that part of the reason he kind of let Gi Hun get the upper hand is that he realized he couldn’t live with himself if he killed Gi Hun to win. If he went against anyone else I don’t think he would’ve taken those punches and lied there waiting to be stabbed.",i think it’s likely that he was planning to just win the money for his mom and debts and he’d kill himself before going to prison he was so ashamed that he told his mom he was on a business trip and he was suicidal after they voted to quit even if he was formulating a plan to hire a good lawyer or go into hiding after he won i do think that part of the reason he kind of let gi hun get the upper hand is that he realized he couldn’t live with himself if he killed gi hun to win if he went against anyone else i don’t think he would’ve taken those punches and lied there waiting to be stabbed
comment,I pretty much could tell by his actions and facial expressions/ body language that he was a manipulator and cold hearted from the beginning. He was using Ali from the start. Sure there’s some redeeming moments but I still hate him for all he’s done but it’s a love hate relationship. It’s really good acting because it’s so good that you actually feel for the characters.,i pretty much could tell by his actions and facial expressions body language that he was a manipulator and cold hearted from the beginning he was using ali from the start sure there’s some redeeming moments but i still hate him for all he’s done but it’s a love hate relationship it’s really good acting because it’s so good that you actually feel for the characters
comment,[deleted],deleted
comment,It never registered with me how bad the stuff he did was. I figured he was just stupid like Gi-hun.,it never registered with me how bad the stuff he did was i figured he was just stupid like gihun
comment,"He was an example of how life can turn bad even when you seemingly have it all in terms of intelligence, education, and career. Just because you have the best education possible does not mean things cant go horribly wrong in the end. And when people are faced with life that is so bad that you see no way out, they will do completely unexpected things. Even really terrible things, no matter the education and what we might expect in terms of morals because of that high education. 

I think its rare you get truly good people in the grand scheme of things, and this shows when people are really faced with life and death situations, or when huge money is involved that could change your life.",he was an example of how life can turn bad even when you seemingly have it all in terms of intelligence education and career just because you have the best education possible does not mean things cant go horribly wrong in the end and when people are faced with life that is so bad that you see no way out they will do completely unexpected things even really terrible things no matter the education and what we might expect in terms of morals because of that high education i think its rare you get truly good people in the grand scheme of things and this shows when people are really faced with life and death situations or when huge money is involved that could change your life
comment,"If that were the case, why would he ever even partake in the games?",if that were the case why would he ever even partake in the games
comment,Dickhead in the end,dickhead in the end
comment,This hits,this hits
comment,[deleted],deleted
comment,the games are all different each “year” it seems so he didnt know what game it was. also it seems to be assumed that he was prepared to die to feel alive. sorta like black hat in westword.,the games are all different each “year” it seems so he didnt know what game it was also it seems to be assumed that he was prepared to die to feel alive sorta like black hat in westword
comment,"I disagree. I think what Sang-woo did was necessary, but it shouldn't be justified or glorified.",i disagree i think what sangwoo did was necessary but it shouldnt be justified or glorified
comment,Just visit wallstreetbets and you will soon see how this is not only possible but also common in people who lose but keeps believing they will win until they hit rock bottom.,just visit wallstreetbets and you will soon see how this is not only possible but also common in people who lose but keeps believing they will win until they hit rock bottom
comment,Selfish and cold,selfish and cold
comment,He was a failure to her face. Sang Woo carried on a charade until someone came and took it all away. Asian mom’s take special pride in their sons. This is the worst way to shame them. It’s completely different.,he was a failure to her face sang woo carried on a charade until someone came and took it all away asian mom’s take special pride in their sons this is the worst way to shame them it’s completely different
comment,"Quite realistic, but that unfortunately shows the ugly side of human nature.",quite realistic but that unfortunately shows the ugly side of human nature
comment,">If society gives us little to no hope to survive (let alone thrive) our only chance is to look out for each other.  
>  
>If Sang-woo had told everyone the trick to the honeycomb game, most people would have lived.  
>  
>If there were more people during the glass bridge game, more people would have lived.  
>  
>If there were more people in the squid game, half of them would have lived.

It's a moot point because everyone could have lived at anytime had they not been greedy. All they had to do was vote to end the games. There was no point in which they were not allowed to do this, even in the middle of a game.

The games are designed for only 1 winner. If you need proof, you can see the scene where the detective discovers the list of the past winners.

&#x200B;

Edit: quote format fix.",if society gives us little to no hope to survive let alone thrive our only chance is to look out for each other if sangwoo had told everyone the trick to the honeycomb game most people would have lived if there were more people during the glass bridge game more people would have lived if there were more people in the squid game half of them would have lived its a moot point because everyone could have lived at anytime had they not been greedy all they had to do was vote to end the games there was no point in which they were not allowed to do this even in the middle of a game the games are designed for only 1 winner if you need proof you can see the scene where the detective discovers the list of the past winners x200b edit quote format fix
comment,"Personally, I see more people hating on people hating on Sang-Woo than people hating Sang-Woo directly.  Is this a Netflix Korean show version of petty virtue signaling now or am I missing something?",personally i see more people hating on people hating on sangwoo than people hating sangwoo directly is this a netflix korean show version of petty virtue signaling now or am i missing something
comment,Sounds like you are underestimating Sang-Woo...,sounds like you are underestimating sangwoo
comment,"I definitely agree with you, but to play devil's advocate, consider it like a triage situation. Both liars took advantage of their friend, but Gi-Hun's situation was very different because Il-Nam was seemingly losing his faculties, and was terminally ill. Il-Nam was likely not going to survive another round, so letting him live would just guarantee that they both die. They were both jerks for what they did, but Sang-Woo was purely selfish, while Gi-Hun was just pragmatic.",i definitely agree with you but to play devils advocate consider it like a triage situation both liars took advantage of their friend but gihuns situation was very different because ilnam was seemingly losing his faculties and was terminally ill ilnam was likely not going to survive another round so letting him live would just guarantee that they both die they were both jerks for what they did but sangwoo was purely selfish while gihun was just pragmatic
comment,"I think Sang Woo wanted the Il Nam to pick the umbrella so they wouldn’t team up with him in the future cause he was old and would hold them back

Cause when Gi Hun picked the umbrella it looked like Sang Woo didn’t want him to pick it. This is just my interpretation of it though",i think sang woo wanted the il nam to pick the umbrella so they wouldn’t team up with him in the future cause he was old and would hold them back cause when gi hun picked the umbrella it looked like sang woo didn’t want him to pick it this is just my interpretation of it though
comment,Which ep are we allowed to discuss up til? The first?,which ep are we allowed to discuss up til the first
comment,"I feel like you missed perhaps the most important theme in this show. 

If society gives us little to no hope to survive (let alone thrive) our only chance is to look out for each other. 

If Sang-woo had told everyone the trick to the honeycomb game, most people would have lived.

If there were more people during the glass bridge game, more people would have lived.

If there were more people in the squid game, half of them would have lived. 

Because Sang-woo was not only selfish, but a murderer, only one person survived the squid game.

That being said, Sang-woo is an amazing character, because I don't hate him for what he did. He is a tragic figure. He saw no choice but to fight for his own survival, but if he had listened to his friend Gi-hun, and worked as a team, so many lives could have been saved.",i feel like you missed perhaps the most important theme in this show if society gives us little to no hope to survive let alone thrive our only chance is to look out for each other if sangwoo had told everyone the trick to the honeycomb game most people would have lived if there were more people during the glass bridge game more people would have lived if there were more people in the squid game half of them would have lived because sangwoo was not only selfish but a murderer only one person survived the squid game that being said sangwoo is an amazing character because i dont hate him for what he did he is a tragic figure he saw no choice but to fight for his own survival but if he had listened to his friend gihun and worked as a team so many lives could have been saved
comment,">For some reason, he doesn't tell the others to all go for the triangle shape despite him figuring out the game. This is the only circumstance where I'd understand him being considered evil, but I'd call it more stupid than evil.

It's a stupid decision for all the reasons you laid out but it's clearly an evil one as well. He deliberately misleads people who had put their trust in him putting them into mortal danger presumably because he recognizes that in the end they too are his competitors. Yeah he would actually be better off at that point making sure they survive until the later rounds but the fact that he fails to grasp this doesn't make what he did morally acceptable. 

Agreed on Ali's betrayal. 

Not sure about pushing the man off the glass bridge. Can't quite remember how that scene played out but was there no option to go past him? With so few seconds left on the clock Sang-Woo did need to act but it seems like he could have taken the risk of landing on the wrong panel himself rather than killing the poor guy 

>Do people not realise that Sang-Woo had to murder her? You can't play squid game with three people that's unfair.

He obviously didn't need to kill her and he didn't even know what game they would be playing at that point. His reasoning for murdering her - that he was afraid her and Gi-Hun would take a vote and call off the games - did make sense but obviously speaks volumes about his character. He would rather not give up the chance to make a large amount of money to save a dying person. Hard to justify that one",for some reason he doesnt tell the others to all go for the triangle shape despite him figuring out the game this is the only circumstance where id understand him being considered evil but id call it more stupid than evil its a stupid decision for all the reasons you laid out but its clearly an evil one as well he deliberately misleads people who had put their trust in him putting them into mortal danger presumably because he recognizes that in the end they too are his competitors yeah he would actually be better off at that point making sure they survive until the later rounds but the fact that he fails to grasp this doesnt make what he did morally acceptable agreed on alis betrayal not sure about pushing the man off the glass bridge cant quite remember how that scene played out but was there no option to go past him with so few seconds left on the clock sangwoo did need to act but it seems like he could have taken the risk of landing on the wrong panel himself rather than killing the poor guy do people not realise that sangwoo had to murder her you cant play squid game with three people thats unfair he obviously didnt need to kill her and he didnt even know what game they would be playing at that point his reasoning for murdering her that he was afraid her and gihun would take a vote and call off the games did make sense but obviously speaks volumes about his character he would rather not give up the chance to make a large amount of money to save a dying person hard to justify that one
comment,"People are going to select the other shapes anyway. Your team is way more valuable than having a whopping 3 less people, especially 3 people who respect and are not a threat to you. And he knew that there were still 4 more rounds. So no, killing your team for 3 less is not better than 0 less people",people are going to select the other shapes anyway your team is way more valuable than having a whopping 3 less people especially 3 people who respect and are not a threat to you and he knew that there were still 4 more rounds so no killing your team for 3 less is not better than 0 less people
comment,My favorite character in terms of complexity. He was the only one who was not afraid to do what had to be done to advance ans was low key the mvp in many of the games if u think about it from many perspectives. Elite game player.,my favorite character in terms of complexity he was the only one who was not afraid to do what had to be done to advance ans was low key the mvp in many of the games if u think about it from many perspectives elite game player
comment,"I like him and Sae more than Gi Hun.

I know Gi Hun is supposed to be more relatable, but can you imagine Sang and Sai dueling full strength in the finale. 

Lol, sorry, I sound like the masked lard asses now.

Seriously though, both of them very much stayed to the core of their character, would do anything to move on, including Sang offing himself so the game doesn't tie and the money doesn't go back to the rest of the previously deceased.",i like him and sae more than gi hun i know gi hun is supposed to be more relatable but can you imagine sang and sai dueling full strength in the finale lol sorry i sound like the masked lard asses now seriously though both of them very much stayed to the core of their character would do anything to move on including sang offing himself so the game doesnt tie and the money doesnt go back to the rest of the previously deceased
comment,"I started to hate him as the season went on, but was still pretty sad when he died. So overall a great character",i started to hate him as the season went on but was still pretty sad when he died so overall a great character
comment,"His act of kindness to Ali is not genuine.  It comes from a place of supremacy -- it is him actually being patronizing.  He helps Ali because he feels like Ali is beneath him, and inevitably manipulates him and throws him away when the time is right.",his act of kindness to ali is not genuine it comes from a place of supremacy it is him actually being patronizing he helps ali because he feels like ali is beneath him and inevitably manipulates him and throws him away when the time is right
comment,My point is that I've seen the same in the States as well,my point is that ive seen the same in the states as well
comment,"Maybe when he dealt in financial crimes he was selfish, but I believe a major part of his motivation from then on was to clear the debt that he incurred on his mother, and restore his mother's pride for her son. 

In Episode 2, he was in a tub ready to end his life rather than face his mother and his consequences. After joining the games again, it was that one goal that drove him- and in the end, he killed himself to ensure that some money and care was provided to his mom by Gi-hun. That is him being selfless imo.",maybe when he dealt in financial crimes he was selfish but i believe a major part of his motivation from then on was to clear the debt that he incurred on his mother and restore his mothers pride for her son in episode 2 he was in a tub ready to end his life rather than face his mother and his consequences after joining the games again it was that one goal that drove him and in the end he killed himself to ensure that some money and care was provided to his mom by gihun that is him being selfless imo
comment,"The big point that makes your take wrong is because I think sangwoo realised that there can only be one winner and was acting under that belief the whole way through, while Gihun was naive and didnt catch on.
 yet when he was presented with a situation where only one person can win, he clearly chose himself even if the other person was an old nice man. 

Sangwoo is just gihun but smarter, he went from giving a random guy bus money without expecting anything to ruthless murderer because he is smart enough to recognise the situation he is in, he just went through the same character arc but much quicker.

Sangwoo doesnt try to save sae because he knows it's her or him so he kills her quickly so she doesnt suffer, he does feel remorse but he quickly controls himself because the next game is coming and he has to worry about that, for me that's why I much prefer sangwoo over gihun.",the big point that makes your take wrong is because i think sangwoo realised that there can only be one winner and was acting under that belief the whole way through while gihun was naive and didnt catch on yet when he was presented with a situation where only one person can win he clearly chose himself even if the other person was an old nice man sangwoo is just gihun but smarter he went from giving a random guy bus money without expecting anything to ruthless murderer because he is smart enough to recognise the situation he is in he just went through the same character arc but much quicker sangwoo doesnt try to save sae because he knows its her or him so he kills her quickly so she doesnt suffer he does feel remorse but he quickly controls himself because the next game is coming and he has to worry about that for me thats why i much prefer sangwoo over gihun
comment,A good tragic character. Ohhhh I love him so much.,a good tragic character ohhhh i love him so much
comment,"Capitalist: Outsources jobs to Asia

Capitalist: “Mexicans are stealing your jobs!”

Working Class: “I sure hate Mexicans.”",capitalist outsources jobs to asia capitalist “mexicans are stealing your jobs” working class “i sure hate mexicans”
comment,"What’s funny is 90% of these comments are missing the point that your post is making. 
People are so confined to a box that they naturally discuss the person being manipulated by the game and don’t look at the creator. Not surprising though, that is how we’re programmed to think.",what’s funny is 90 of these comments are missing the point that your post is making people are so confined to a box that they naturally discuss the person being manipulated by the game and don’t look at the creator not surprising though that is how we’re programmed to think
comment,I don't get it. He was the best character.,i dont get it he was the best character
comment,"Sae Byeok was totally unnecessary.  She was effectively dead already.  She was way too injured to continue much longer.  I can fully understand most of his choices up to that point, even in honeycomb.  Killing her made no sense whatsoever to me.",sae byeok was totally unnecessary she was effectively dead already she was way too injured to continue much longer i can fully understand most of his choices up to that point even in honeycomb killing her made no sense whatsoever to me
comment,"Yes but they knew they were at risk of death, along with everyone else. They all knew they were probably gonna die some way, and if they didn't they were either in denial or stupid",yes but they knew they were at risk of death along with everyone else they all knew they were probably gonna die some way and if they didnt they were either in denial or stupid
comment,There’s always a choice my friend. For desperate people they’re rarely good ones. That’s the point,there’s always a choice my friend for desperate people they’re rarely good ones that’s the point
comment,Did you know he graduated college,did you know he graduated college
comment,People are hating on him but I would've done the same thing as him with Ali,people are hating on him but i wouldve done the same thing as him with ali
comment,"That's what I read after I finished the season. After rewatching it, I could definitely tell",thats what i read after i finished the season after rewatching it i could definitely tell
comment,Sang-woo reminds me of Reiner from AOT for some reason,sangwoo reminds me of reiner from aot for some reason
comment,He could have said “pick the easiest shape just in case” he’s a snake!,he could have said “pick the easiest shape just in case” he’s a snake
comment,"I changed my mind fuck Sang-Woo
(Yes just finished ep.6)",i changed my mind fuck sangwoo yes just finished ep6
comment,/r/thatsthejoke,rthatsthejoke
comment,It’s clear from that point that he’s already done the math and knows only one person is getting out alive. He screws them all over from the jump.,it’s clear from that point that he’s already done the math and knows only one person is getting out alive he screws them all over from the jump
comment,"So, he tricked the old man by playing along with his dementia, right?",so he tricked the old man by playing along with his dementia right
comment,"i could tell early on i wouldn’t like him and by the time the marbles game came i was right. absolutely hated him. HOWEVER, now that it’s been about a week and some change since i finished the show and i’ve been able to give it some thought, the man was just doing what he could to survive. i still don’t like him as a character but i won’t hold his actions against him because i can’t honestly say i wouldn’t do the same if i were in his situation.",i could tell early on i wouldn’t like him and by the time the marbles game came i was right absolutely hated him however now that it’s been about a week and some change since i finished the show and i’ve been able to give it some thought the man was just doing what he could to survive i still don’t like him as a character but i won’t hold his actions against him because i can’t honestly say i wouldn’t do the same if i were in his situation
comment,Would they not have all died at the end though?,would they not have all died at the end though
comment,I don’t blame him. If you were in his spot wouldn’t you do anything to try and survive? He’s strong and smart,i don’t blame him if you were in his spot wouldn’t you do anything to try and survive he’s strong and smart
