type,text,processed_text
comment,"From a writer's point of view, a very well thought out character. Well-blended to show strengths as well as flaws.

From a viewer's point of view, he should have done better. Being the top of the class, he should have played safe instead of committing such heinous acts that snowballed into his current situation.",from a writers point of view a very well thought out character wellblended to show strengths as well as flaws from a viewers point of view he should have done better being the top of the class he should have played safe instead of committing such heinous acts that snowballed into his current situation
comment,Unless your Korean what person is going to be interested in an episode and a half of foreign language backstory. We got all the backstory we needed to enjoy the games,unless your korean what person is going to be interested in an episode and a half of foreign language backstory we got all the backstory we needed to enjoy the games
comment,"I ended up hating him, which means he was a great actor.",i ended up hating him which means he was a great actor
comment,"Should have killed the main dude while he was distracted with the door through. Like he walks over 067, sees she's bleeding to death, and kills her? Wasted opportunity. Deserved to lose the final game.",should have killed the main dude while he was distracted with the door through like he walks over 067 sees shes bleeding to death and kills her wasted opportunity deserved to lose the final game
comment,Ah maybe the subtitles are not great then. I don't speak Korean so I used the subtitles and it was much clearer to me that there was only one winner before the officer found the records.,ah maybe the subtitles are not great then i dont speak korean so i used the subtitles and it was much clearer to me that there was only one winner before the officer found the records
comment,"There is no indication that there could be only one winner.  

He probably chose Ali because he would be a strong alli if they where to wkrk together, but easily fooled if they had to be at odds.",there is no indication that there could be only one winner he probably chose ali because he would be a strong alli if they where to wkrk together but easily fooled if they had to be at odds
comment,"Yeah the rules, I get it. Not telling them that you're going to kill them is a pretty HUGE deal. There's no freedom to that. It's withholding information to entice people to play. Like I said, that alone makes him 100% evil. I don't know how you can still be on his side and think he's not an evil person after that.

Also yeah, he's giving them a chance. Why does he have to kill them? Play a lottery or something.",yeah the rules i get it not telling them that youre going to kill them is a pretty huge deal theres no freedom to that its withholding information to entice people to play like i said that alone makes him 100 evil i dont know how you can still be on his side and think hes not an evil person after that also yeah hes giving them a chance why does he have to kill them play a lottery or something
comment,"Your submission has been removed as we no longer allow Youtube videos.


*I am a bot, and this action was performed automatically. Please [contact the moderators of this subreddit](/message/compose/?to=/r/squidgame) if you have any questions or concerns.*",your submission has been removed as we no longer allow youtube videos i am a bot and this action was performed automatically please contact the moderators of this subredditmessagecomposetorsquidgame if you have any questions or concerns
comment,Idk about genuine,idk about genuine
comment,"loved him at the start, hated him at the end.",loved him at the start hated him at the end
comment,"Yeah I think using her sexuality didn’t really work only cause the stakes are life and death. Not cause she doesn’t have the same sway with men anymore. No one’s gonna pick an attractive woman over staying alive. It’s just not enough.

Like Deok-Su. He got sex, let her into his little group, which gave her protection during the night riot. But then as soon as it came to actual life and death with the tug of war, he dropped her rather than weaken his team. Sexuality can only get you so far when the stakes are that high",yeah i think using her sexuality didn’t really work only cause the stakes are life and death not cause she doesn’t have the same sway with men anymore no one’s gonna pick an attractive woman over staying alive it’s just not enough like deoksu he got sex let her into his little group which gave her protection during the night riot but then as soon as it came to actual life and death with the tug of war he dropped her rather than weaken his team sexuality can only get you so far when the stakes are that high
comment,"Oof. Victim blaming here.

Sang Woo lying to him is basically what got him killed.",oof victim blaming here sang woo lying to him is basically what got him killed
comment,"I think that’s true for a lot of them. That’s why they went back in. Gi-hun was in a tonne of danger from those thugs over his gambling debts. They were threatening to take his eyes and organs if he didn’t pay money he had no way of paying. It’s not like he could have stayed out of the game and stayed safe. He was in danger in the real world too.

Same with Deok-su. He had nowhere safe to go after the thugs from the Philippines came for him",i think that’s true for a lot of them that’s why they went back in gihun was in a tonne of danger from those thugs over his gambling debts they were threatening to take his eyes and organs if he didn’t pay money he had no way of paying it’s not like he could have stayed out of the game and stayed safe he was in danger in the real world too same with deoksu he had nowhere safe to go after the thugs from the philippines came for him
comment,if he didn't push the guy they all would've died. sae-byeok was bleeding out from the glass they were hit with because they made it across with like a second to spare.,if he didnt push the guy they all wouldve died saebyeok was bleeding out from the glass they were hit with because they made it across with like a second to spare
comment,"He is graduated from Seoul University, smart and cunning.",he is graduated from seoul university smart and cunning
comment,Sexy. SNU SNU.,sexy snu snu
comment,I understand Sung-Woo's decision with Ali but I'd still describe him as selfish for it and what he does afterwards goes too far.,i understand sungwoos decision with ali but id still describe him as selfish for it and what he does afterwards goes too far
comment,"Even the archetypal victims benefited from his behavior.  In the end i think his ruthlessness didn’t reflect his greed, but his desperation to avoid shame. He was willing to die an awful death for the price of some sort of honorable legacy (ensuring his mother’s wellbeing) rather than live in his status quo.",even the archetypal victims benefited from his behavior in the end i think his ruthlessness didn’t reflect his greed but his desperation to avoid shame he was willing to die an awful death for the price of some sort of honorable legacy ensuring his mother’s wellbeing rather than live in his status quo
comment,"I think for honeycomb game we can’t say for sure.  Sang-woo seemed only partially sure himself, and it could have easily been like Marbles where everyone from one shape was going to be competing.  I believe his hesitation isn’t to show that he’s purely selfish but that he’s careful.",i think for honeycomb game we can’t say for sure sangwoo seemed only partially sure himself and it could have easily been like marbles where everyone from one shape was going to be competing i believe his hesitation isn’t to show that he’s purely selfish but that he’s careful
comment,"I think there are other interpretations of the ending scene with Il-nam.  

The way I saw it was that he set the whole thing up to spark Gi-hun’s faith in humanity. The whole reason Il-nam brings Gi-hun there is because he’s concerned for him because he knows he’s a decent person. Pretty sure he planned to die at exactly midnight too.  The point was that Il-nam didn’t need to see the outcome, because the wager wasn’t the point.  It was for Gi-hun alone to experience.  

Additionally, Il-nam says “anybody” can help him, which I thought was blatantly clear to be a rigged game in favor of Gi-hun because it meant he himself could literally just walk down and help the guy.  He was supposed to realize this. 

Otherwise are we supposed to believe it was all just a coincidence that such a “game” just randomly happened to occur at the exact time Gi-hun had been invited for by brains behind it everything? Interestingly what I do find cynical is how so many interpreted that scene.",i think there are other interpretations of the ending scene with ilnam the way i saw it was that he set the whole thing up to spark gihun’s faith in humanity the whole reason ilnam brings gihun there is because he’s concerned for him because he knows he’s a decent person pretty sure he planned to die at exactly midnight too the point was that ilnam didn’t need to see the outcome because the wager wasn’t the point it was for gihun alone to experience additionally ilnam says “anybody” can help him which i thought was blatantly clear to be a rigged game in favor of gihun because it meant he himself could literally just walk down and help the guy he was supposed to realize this otherwise are we supposed to believe it was all just a coincidence that such a “game” just randomly happened to occur at the exact time gihun had been invited for by brains behind it everything interestingly what i do find cynical is how so many interpreted that scene
comment,"The games were drawn on the wall though, they were there the whole time. The beds were just covering them.",the games were drawn on the wall though they were there the whole time the beds were just covering them
comment,"But why should a young, healthy 33 year old who has a wife and kid(s? I can't remember) not be valued more than someone who is terminally ill and apparently no longer mentally sound? One still has a life ahead of them and massive responsibilities, the other has neither",but why should a young healthy 33 year old who has a wife and kids i cant remember not be valued more than someone who is terminally ill and apparently no longer mentally sound one still has a life ahead of them and massive responsibilities the other has neither
comment,And/or stoned.,andor stoned
comment,amazing,amazing
comment,Very well written. Can’t stand the guy.,very well written can’t stand the guy
comment,Was a fucking asshole and he still made me cry,was a fucking asshole and he still made me cry
comment,"Okay, they should have told them that they would die. But I still feel it would have not made huge change as you see after the vote almost all the players came back to the game even after KNOWING they might die. So it almost made no difference.",okay they should have told them that they would die but i still feel it would have not made huge change as you see after the vote almost all the players came back to the game even after knowing they might die so it almost made no difference
comment,"No it’s not, and that’s not even the point of my post. Read again.",no it’s not and that’s not even the point of my post read again
comment,i've been saying asshat since middle school haha. i didn't even realize your name honestly.,ive been saying asshat since middle school haha i didnt even realize your name honestly
comment,"Imo, he reminded the guards of that third clause because they were objecting to the people who wanted to go home and there was a clause that settled that. And then he saw the money.",imo he reminded the guards of that third clause because they were objecting to the people who wanted to go home and there was a clause that settled that and then he saw the money
comment,"The debter will come and take everything remotely related to Sangwoo that includes his mother’s shop, presumably some of the money he owed are to gang members and don’t play by rules",the debter will come and take everything remotely related to sangwoo that includes his mother’s shop presumably some of the money he owed are to gang members and don’t play by rules
comment,"True, but they were mostly still necessary and that's what a lot of people don't realise",true but they were mostly still necessary and thats what a lot of people dont realise
comment,He was a good guy until he killed Ali,he was a good guy until he killed ali
comment,"Bad person, excelent player",bad person excelent player
comment,"He was written so consistently. He sacrificed his humanity to win. Even if he had to lose, someone else had to win because otherwise his sacrifice would have been in vain. He preached that mentality after the marble game and he backed up his words in the last game.",he was written so consistently he sacrificed his humanity to win even if he had to lose someone else had to win because otherwise his sacrifice would have been in vain he preached that mentality after the marble game and he backed up his words in the last game
comment,Hate him but totally understand his motivations and I don’t think he’s a total demon of a person like Deok-Su,hate him but totally understand his motivations and i don’t think he’s a total demon of a person like deoksu
comment,"He should have some fucking compassion. I’m beyond sick of people defending him. It’s about survival not murder, they should work together",he should have some fucking compassion i’m beyond sick of people defending him it’s about survival not murder they should work together
comment,One of those friend that you can’t trust ! ,one of those friend that you can’t trust
comment,But is he smart?,but is he smart
comment,He has high standards,he has high standards
comment,"A man of focus, commitment and sheer fucking will",a man of focus commitment and sheer fucking will
comment,"Realisticly would have been the champ,showed both level headed smart while planning and making decisions and then street smart during the marble game by immediately able to identify and use the resources around him. He's willing to do whatever it takes and has the will power to commit actions. We wouldn't take kindly to him as members of the audience,but in real life with his tenacity and intellect he would get very far.",realisticly would have been the champshowed both level headed smart while planning and making decisions and then street smart during the marble game by immediately able to identify and use the resources around him hes willing to do whatever it takes and has the will power to commit actions we wouldnt take kindly to him as members of the audiencebut in real life with his tenacity and intellect he would get very far
comment,total asshole… definitely needed as a character though and made the show more interesting overall,total asshole… definitely needed as a character though and made the show more interesting overall
comment,"There is something to be said about dying with dignity, though. If he figured out the game so early, then he knew he only had a 1/456 chance of being the final survivor already. That's obviously not great odds. 

If any of them believed in an afterlife, this game they were in--literally cutthroat as it was--still has bearing on their conscience and their soul--if there is such a thing. Just because you have to kill for survival, doesn't make the moral dilemma any easier to justify or handle. 

This is exactly why he wanted to die in the final game. Once he realized what he's done to get to this point in the game and couldn't win, he knew he couldn't live with himself. The only choice was death. 

I find that tragic, but saying he was smart and calculated is pretty myopic, too. He allowed his humanity to be consumed by what ultimately was an *optional* game. Even in an optimal conclusion, he would still have to deal with the fact that he became a killer for the rest of his life for nothing more than money.",there is something to be said about dying with dignity though if he figured out the game so early then he knew he only had a 1456 chance of being the final survivor already thats obviously not great odds if any of them believed in an afterlife this game they were inliterally cutthroat as it wasstill has bearing on their conscience and their soulif there is such a thing just because you have to kill for survival doesnt make the moral dilemma any easier to justify or handle this is exactly why he wanted to die in the final game once he realized what hes done to get to this point in the game and couldnt win he knew he couldnt live with himself the only choice was death i find that tragic but saying he was smart and calculated is pretty myopic too he allowed his humanity to be consumed by what ultimately was an optional game even in an optimal conclusion he would still have to deal with the fact that he became a killer for the rest of his life for nothing more than money
comment,Very well written but still a piece of shit. Look what he did to his own mother.,very well written but still a piece of shit look what he did to his own mother
comment,He made me have a thing for older men,he made me have a thing for older men
comment,"> His devolution from white collar fraud to cold-blooded murderer was so compelling to watch

Not much of a jump. A lot of those white collar dudes are fucking vicious.",his devolution from white collar fraud to coldblooded murderer was so compelling to watch not much of a jump a lot of those white collar dudes are fucking vicious
comment,"Top character, until he decided to grow a conscience...",top character until he decided to grow a conscience
comment,"He would have been more attentive to Sang Woo approaching from that back if that was the case, though.",he would have been more attentive to sang woo approaching from that back if that was the case though
comment,Bro betrayed gi hunn by not telling him about the honeycomb game smhh.possss like i said,bro betrayed gi hunn by not telling him about the honeycomb game smhhpossss like i said
comment,"I think Sang-woo's subjective placement in the morality spectrum is interesting, because there's a lot of nuance between people's opinions, and I think you can tell a lot from people by that. Those who hate him endlessly and disregard any humanity in him tend to hold on very strongly to their moral values. Those who glorify his actions and try justify them tend to have a competitive and practical mentality, sort of like every man for themselves.

I think if Sang-woo was the MC instead of Gi-hun, he wouldn't be hated as much because I assume we would see the process of him losing his humanity and letting guilt eat him up. I would've liked it that way better because it suits the vibe Squid Game was going for. I don't really dislike him for killing Ali and Sae-byeok either, rather I sort of feel empathy for him.",i think sangwoos subjective placement in the morality spectrum is interesting because theres a lot of nuance between peoples opinions and i think you can tell a lot from people by that those who hate him endlessly and disregard any humanity in him tend to hold on very strongly to their moral values those who glorify his actions and try justify them tend to have a competitive and practical mentality sort of like every man for themselves i think if sangwoo was the mc instead of gihun he wouldnt be hated as much because i assume we would see the process of him losing his humanity and letting guilt eat him up i wouldve liked it that way better because it suits the vibe squid game was going for i dont really dislike him for killing ali and saebyeok either rather i sort of feel empathy for him
comment,i like how it was only after the prize money reveal (and learning 1 death = 100mil won) did he change his mind about ending the game and also became self-preserving. the shift from helping gi-hun get out of his shock and survive in the first game to tricking his team into getting complicated shapes in the second game says so much about his character,i like how it was only after the prize money reveal and learning 1 death 100mil won did he change his mind about ending the game and also became selfpreserving the shift from helping gihun get out of his shock and survive in the first game to tricking his team into getting complicated shapes in the second game says so much about his character
comment,At what point does he lose his glasses? Do they ever address that?,at what point does he lose his glasses do they ever address that
comment,Do you think Ali could hurt someone?,do you think ali could hurt someone
comment,"Top 2 from the start to end. Out of everyone in the game, he was there solely to win",top 2 from the start to end out of everyone in the game he was there solely to win
comment,"He had nothing to lose - IRL, unless he could repay his debts he was going to prison or worse. He played the games that way. Intelligent and ruthless.

I think it odd that he is painted as a bad character when it was really kill or be killed. None of the characters were there because they were good people and no one won this game without causing other people's deaths.

You can like someone who died more but they are still dead. Liking someone who won more is just illogical.

In the end he accepted his loss and is the only reason the main protagonist has 45 billion won in a bank account - and yet the confused audience is still rooting for the winner - but the winner was a completely awful person both before the games and after - he wallowed in self pity for a year rather than immediately fulfilling the girl's wish for them to each help the others child.",he had nothing to lose irl unless he could repay his debts he was going to prison or worse he played the games that way intelligent and ruthless i think it odd that he is painted as a bad character when it was really kill or be killed none of the characters were there because they were good people and no one won this game without causing other peoples deaths you can like someone who died more but they are still dead liking someone who won more is just illogical in the end he accepted his loss and is the only reason the main protagonist has 45 billion won in a bank account and yet the confused audience is still rooting for the winner but the winner was a completely awful person both before the games and after he wallowed in self pity for a year rather than immediately fulfilling the girls wish for them to each help the others child
comment,[Great character but...](http://imgur.com/a/EZcT7Of),great character but
comment,[deleted],deleted
comment,"If the circumstances of my life take me to a road where I have to cut off my own hand. And someone who could help me sees my situation. And what they offer me instead is the chance to keep my hands if I cut off someone else's. Regardless of what I choose, I can absolutely blame the person who saw me, could have helped, and instead gave me Sophie's choice.",if the circumstances of my life take me to a road where i have to cut off my own hand and someone who could help me sees my situation and what they offer me instead is the chance to keep my hands if i cut off someone elses regardless of what i choose i can absolutely blame the person who saw me could have helped and instead gave me sophies choice
comment,"I’d like to see the show from her perspective a bit more.  The show reminds me of Karate Kid to an extent.  Upon first viewing and first dissection, Danny is the nice guy/protagonist.  Once you think about it more and more, Johnny in fact should be the protagonist.  Most of Gi Huun’s actions are contrary to the game’s purpose and only delay the inevitable, giving false hope to all his “friends”.  Sang Woo however understands the game and is more realistic in his approach.",i’d like to see the show from her perspective a bit more the show reminds me of karate kid to an extent upon first viewing and first dissection danny is the nice guyprotagonist once you think about it more and more johnny in fact should be the protagonist most of gi huun’s actions are contrary to the game’s purpose and only delay the inevitable giving false hope to all his “friends” sang woo however understands the game and is more realistic in his approach
comment,I didn’t understand the red hair dye at the end. Why exactly did he do that? Was it some kind of fashion statement? It made him look like even more of a pussy than he was lol,i didn’t understand the red hair dye at the end why exactly did he do that was it some kind of fashion statement it made him look like even more of a pussy than he was lol
comment,Did you know he graduated SNU?,did you know he graduated snu
comment,"fantastic character, quite unpredictable as well, dislike him as a person tho lol",fantastic character quite unpredictable as well dislike him as a person tho lol
comment,"It's easier to recognize Gi-Hun's situation as pragmatic like you said. With Il-Nam's mind seemingly giving out, letting him win honestly is honorable but a waste of life. From Gi-Hun's perspective it was either that he die or they both die. Sang-Woo didn't have that same justification, so his actions were far more selfish.",its easier to recognize gihuns situation as pragmatic like you said with ilnams mind seemingly giving out letting him win honestly is honorable but a waste of life from gihuns perspective it was either that he die or they both die sangwoo didnt have that same justification so his actions were far more selfish
