type,text,processed_text
comment,"Sang-Woo showed his true colors when he could not confess to his own mother that she would lose her tiny fish shop because he promised it as collateral for his reckless loans. His own mother. 

This theme continues to grow and manifest in many ways until the ultimate moment when >! Gi-Hun overpowers him in the squid game. Repeated punches to the face ""You killed them, you killed them, you killed them."" He is forced to face the facts. His choice is essentially ""this truth is too difficult, I have hurt too many people, I have no future."" \*knife to the neck\*!<

>!There is a little bit of Sang-Woo in all of us. But please, rather than harm yourself or others, become a better person. !<",sangwoo showed his true colors when he could not confess to his own mother that she would lose her tiny fish shop because he promised it as collateral for his reckless loans his own mother this theme continues to grow and manifest in many ways until the ultimate moment when gihun overpowers him in the squid game repeated punches to the face you killed them you killed them you killed them he is forced to face the facts his choice is essentially this truth is too difficult i have hurt too many people i have no future knife to the neck there is a little bit of sangwoo in all of us but please rather than harm yourself or others become a better person
comment,"I would have prefered Sang-woo as the protagonist. Gi-hun is a bit cartoonish (I'm using the word that the writer/director used himself). I really like how Bong Joon-ho (director of Parasite) said that Sang-woo was ""at the heart of various moral dilemmas"". He really was. There wouldn't be any dilemmas if Sang-woo was evil, monster, whatever. He wasn't, and none of what he's done came easy to him.",i would have prefered sangwoo as the protagonist gihun is a bit cartoonish im using the word that the writerdirector used himself i really like how bong joonho director of parasite said that sangwoo was at the heart of various moral dilemmas he really was there wouldnt be any dilemmas if sangwoo was evil monster whatever he wasnt and none of what hes done came easy to him
comment,I think he just wanted Seong Gi-Hun out. He was humiliated to be there. He believed himself superior to his friend but was embarrassed to be seen there with him. I don’t think it was out of greed I think it was shame.,i think he just wanted seong gihun out he was humiliated to be there he believed himself superior to his friend but was embarrassed to be seen there with him i don’t think it was out of greed i think it was shame
comment,How could you hate this guy this guy right here he went to SNU he’s so smart you want this guy on your team!,how could you hate this guy this guy right here he went to snu he’s so smart you want this guy on your team
comment,"Sang-Woo had the game figured out before everyone else did.  He was the smartest player and the most ruthless (ruthless in the sense of only one player can win, and in an animalistic sense, kill or be killed).",sangwoo had the game figured out before everyone else did he was the smartest player and the most ruthless ruthless in the sense of only one player can win and in an animalistic sense kill or be killed
comment,damn sexy dilf,damn sexy dilf
comment,"He also wasn’t a fucking asshole to his mum. He always got her gifts from his business trips, he called her often, he was nice to her and treated her the way she deserves to be treated, he sacrificed himself so she can get the money",he also wasn’t a fucking asshole to his mum he always got her gifts from his business trips he called her often he was nice to her and treated her the way she deserves to be treated he sacrificed himself so she can get the money
comment,"He’s probably the most realistic of all the characters. People love to hate on him, but let’s not pretend we wouldn’t also do whatever we needed to do to survive, regardless of the cash involved.",he’s probably the most realistic of all the characters people love to hate on him but let’s not pretend we wouldn’t also do whatever we needed to do to survive regardless of the cash involved
comment,"I think a big point of the Sang-woo Gi-hun dichotomy was to make viewers question what makes someone a bad person

Sang-woo and Gi-hun are similarly-aged men who did similarly crooked things: stealing money from their mothers for personal gain. But their approach to the game is different. Sang-woo is the cynical realist while Gi-hun is the hopeful idealist. Sang-woo literally does the shoving, yet while Gi-hun says it’s wrong, he still benefits. It’s essentially laid out in their argument after the 5th game. If Sang-woo hadn’t have pushed him, they’d both probably be dead.

So does that make Sang-woo a bad person? I think that’s one of the questions the director wants the audience to question. He’s in some gray area between Gi-hun, who rejects violence, and Deok-su, who enjoys it

Do I think he’s a bad person? Yes. Do I think many people would do what he did if they were in the game? Yes.",i think a big point of the sangwoo gihun dichotomy was to make viewers question what makes someone a bad person sangwoo and gihun are similarlyaged men who did similarly crooked things stealing money from their mothers for personal gain but their approach to the game is different sangwoo is the cynical realist while gihun is the hopeful idealist sangwoo literally does the shoving yet while gihun says it’s wrong he still benefits it’s essentially laid out in their argument after the 5th game if sangwoo hadn’t have pushed him they’d both probably be dead so does that make sangwoo a bad person i think that’s one of the questions the director wants the audience to question he’s in some gray area between gihun who rejects violence and deoksu who enjoys it do i think he’s a bad person yes do i think many people would do what he did if they were in the game yes
comment,Technically it's kinda the same thing but without dying directly. The people at the top of corporations are the one's not paying their workers enough but people just ignore that part because they want to focus on the customers who don't tip probably because they are also struggling.,technically its kinda the same thing but without dying directly the people at the top of corporations are the ones not paying their workers enough but people just ignore that part because they want to focus on the customers who dont tip probably because they are also struggling
comment,That is a good point that I didn't consider. It was all about skill in those games whereas Marbles and Glass Stepping Stones was 100% a game of luck or skill (depending on marble game).,that is a good point that i didnt consider it was all about skill in those games whereas marbles and glass stepping stones was 100 a game of luck or skill depending on marble game
comment,I think considering his situation he was a very realistic character.,i think considering his situation he was a very realistic character
comment,What makes him a good villain is he thinks his intentions are good and the audience can understand them.  As the games go on it becomes clear it's going to come down to him vs everyone else.  Put into a life or death situation he will choose his own life.  Everyone can understand that.,what makes him a good villain is he thinks his intentions are good and the audience can understand them as the games go on it becomes clear its going to come down to him vs everyone else put into a life or death situation he will choose his own life everyone can understand that
comment,"I wouldn't see it that way.  More so that everyone in this situation was using commodities they did in their regular lives and increasingly realizing what true value in life is as the stakes continued to be raised.  In a different situation, her seduction abilities would still be viable.  To an extent, she was still able tempt and sway Deok-su with her sexuality until he no longer had a use for her.  As you may recall, Mi-nyeo's tactic the first time around playing was to plead for mercy as a mother for her child, indicating to me that she's an opportunist con using whatever is at her disposal in order to deceive and survive.",i wouldnt see it that way more so that everyone in this situation was using commodities they did in their regular lives and increasingly realizing what true value in life is as the stakes continued to be raised in a different situation her seduction abilities would still be viable to an extent she was still able tempt and sway deoksu with her sexuality until he no longer had a use for her as you may recall minyeos tactic the first time around playing was to plead for mercy as a mother for her child indicating to me that shes an opportunist con using whatever is at her disposal in order to deceive and survive
comment,Might as well equate Ali to Deok-Su if you think the tug of war game makes them all murderers.,might as well equate ali to deoksu if you think the tug of war game makes them all murderers
comment,"I still don’t think only one person *had* to win, as the squid game explanation in the beginning of the game showed that the whole offensive team won when someone stepped on the head. The games are set up so as few people as possible could make it to the end, we only saw a small portion of the winners book, and likely these games got pretty dog eat dog in previous years, too.",i still don’t think only one person had to win as the squid game explanation in the beginning of the game showed that the whole offensive team won when someone stepped on the head the games are set up so as few people as possible could make it to the end we only saw a small portion of the winners book and likely these games got pretty dog eat dog in previous years too
comment,"Exactly, in fact, doing it when he did you could say it saved their lives.",exactly in fact doing it when he did you could say it saved their lives
comment,[deleted],deleted
comment,"I love his multi-dimensional personality its scarily real. I am of the belief no one is pure good and no one is purely bad, Sang Woo is not a bad person, he is a normal person. He tries to be good when he can, but has one goal in mind, to negate his wrongdoings and no let it get to his mother. This is a person who came under debt not because he was needy, just because he was greedy and embezzled money, a genius. The worst thing that could happen to him was a life in prison, yet for him it was facing his mother and not being the person she was thinking he was, the reason for committing suicide.

He had made peace with himself about the horrible things he was gonna do before entering the 2nd time, how is fooling Ali different from Seong Gi-hun fooling the old man? its because he showed no remorse? I think the character went emotionally bankrupt after he broke down in ep 6. Decided to get his hands dirty and do what must be done to make sure only he and Seong Gi-hun are left, and entrusting him to take care of his mother.

One of the realest characters, hes good when he can and hes bad when he has to. He does not fit the cookie cutter role of a good-guy or bad-guy but just someone who had to win whatever it takes",i love his multidimensional personality its scarily real i am of the belief no one is pure good and no one is purely bad sang woo is not a bad person he is a normal person he tries to be good when he can but has one goal in mind to negate his wrongdoings and no let it get to his mother this is a person who came under debt not because he was needy just because he was greedy and embezzled money a genius the worst thing that could happen to him was a life in prison yet for him it was facing his mother and not being the person she was thinking he was the reason for committing suicide he had made peace with himself about the horrible things he was gonna do before entering the 2nd time how is fooling ali different from seong gihun fooling the old man its because he showed no remorse i think the character went emotionally bankrupt after he broke down in ep 6 decided to get his hands dirty and do what must be done to make sure only he and seong gihun are left and entrusting him to take care of his mother one of the realest characters hes good when he can and hes bad when he has to he does not fit the cookie cutter role of a goodguy or badguy but just someone who had to win whatever it takes
comment,https://www.investopedia.com/terms/f/futures.asp#what-are-futures,
comment,"God my heart just broke in the last episode when he apologized to Gihun. At the end of his life, he remembers his childhood, before the coldness of capitalism corrupted him piece by piece. He realizes what he's become. God what a well written character.",god my heart just broke in the last episode when he apologized to gihun at the end of his life he remembers his childhood before the coldness of capitalism corrupted him piece by piece he realizes what hes become god what a well written character
comment,Sang woo did not deserve to move on smh,sang woo did not deserve to move on smh
comment,"Huh, I had the exact opposite read of it - that he was trying to remove that last bit of faith, and if he had lived longer, he was going to say ""see, you could have helped him yourself, but getting answers from me was more important"".

I can see your read on it though. If everything else was staged, why wouldn't this be?",huh i had the exact opposite read of it that he was trying to remove that last bit of faith and if he had lived longer he was going to say see you could have helped him yourself but getting answers from me was more important i can see your read on it though if everything else was staged why wouldnt this be
comment,"He had a good job. Yet he chose to be greedy. 

Others were doing it to help their families",he had a good job yet he chose to be greedy others were doing it to help their families
comment,"thing is though, Sang-woo was (to my understanding) probably responsible for alot of lives being financially ruined prior to entering the game. Id imagine the money he lost was not just his own, his complete lack of consideration to the lives of others, especially those who implicity trust him with thier lives *cough* ali *cough* can be an allegory for dodgy hedge fund managers. 

He gives a small gift to Ali through money he doesnt really have (similar to theatrics of hedge fund managers sucking in naive clients) they then trust you with more and more, even though you may not be acting in their best interests. Eventually they trust you with their whole lives for some hail mary pass (again see imvestor and financial scammers) front up all of their livelyhood and they are the ones who suffer. Id imagine the gaming in futures wasnt just with sangwoos lovelyhood hence the embezeling and financial charges.",thing is though sangwoo was to my understanding probably responsible for alot of lives being financially ruined prior to entering the game id imagine the money he lost was not just his own his complete lack of consideration to the lives of others especially those who implicity trust him with thier lives cough ali cough can be an allegory for dodgy hedge fund managers he gives a small gift to ali through money he doesnt really have similar to theatrics of hedge fund managers sucking in naive clients they then trust you with more and more even though you may not be acting in their best interests eventually they trust you with their whole lives for some hail mary pass again see imvestor and financial scammers front up all of their livelyhood and they are the ones who suffer id imagine the gaming in futures wasnt just with sangwoos lovelyhood hence the embezeling and financial charges
comment,"I’m inclined to agree, he’s only hated on because he tried to stay alive, which anyone would do, but he wasn’t the “main character”, so we had to dislike him",i’m inclined to agree he’s only hated on because he tried to stay alive which anyone would do but he wasn’t the “main character” so we had to dislike him
comment,"Also, a point I haven’t seen made as often is that for the first two games, one can effectively argue that the players who died weren’t killed by the actions of their opponents but by their lack of skill/strength/luck. It can even be applied to game 3 (tug of war) because even though Gi-hun’s team lacked strength, they made up for it with skill and strategy. 

So even with Sang-woo withholding his knowledge about the honeycomb game, if someone was skilled enough to pick out the shape or smart enough to try a different way (heating the needle, licking the dalgona), knowledge of the game beforehand was not absolutely necessary to winning the game, and each player was ultimately responsible for their own victory or demise in the beginning (not counting the dormitory riot), not Sang-woo. Of course, that all comes crashing down with the last 3 games, where most of the players’ deaths came at the hands of someone else fucking them over.",also a point i haven’t seen made as often is that for the first two games one can effectively argue that the players who died weren’t killed by the actions of their opponents but by their lack of skillstrengthluck it can even be applied to game 3 tug of war because even though gihun’s team lacked strength they made up for it with skill and strategy so even with sangwoo withholding his knowledge about the honeycomb game if someone was skilled enough to pick out the shape or smart enough to try a different way heating the needle licking the dalgona knowledge of the game beforehand was not absolutely necessary to winning the game and each player was ultimately responsible for their own victory or demise in the beginning not counting the dormitory riot not sangwoo of course that all comes crashing down with the last 3 games where most of the players’ deaths came at the hands of someone else fucking them over
comment,>you're funny! I love your edit.. IT IS still pretty ruthless... people get all crazy when you don't agree with them and have opinions like.. dude.. ok yeah sure.. but.. still ruthless..,youre funny i love your edit it is still pretty ruthless people get all crazy when you dont agree with them and have opinions like dude ok yeah sure but still ruthless
comment,"Hate him, smiled when he died, I fuckin loved Ali",hate him smiled when he died i fuckin loved ali
comment,Is he single?,is he single
comment,"Well technically he just tricked 2, the first 2 people to die in the first game, after that everyone was on the same page and understood that if you loose you die.",well technically he just tricked 2 the first 2 people to die in the first game after that everyone was on the same page and understood that if you loose you die
comment,"Huh? Did you see the part where he was gonna stab Sang Woo in his sleep before the final game?

Yes he voted to end it later but he was  not willing to end the game right then and there. He had to be stopped from killing Sang Woo by Sae Byok 

He only decided to vote to end once he had won.",huh did you see the part where he was gonna stab sang woo in his sleep before the final game yes he voted to end it later but he was not willing to end the game right then and there he had to be stopped from killing sang woo by sae byok he only decided to vote to end once he had won
comment,The most realistic character,the most realistic character
comment,Sang-Woo reminds me of Robert from the movie red dawn. He started out as a normal reasonably nice guy then death and violence desensitized him and wore down his empathy and compassion. Personally I hated the crazy lady the most.,sangwoo reminds me of robert from the movie red dawn he started out as a normal reasonably nice guy then death and violence desensitized him and wore down his empathy and compassion personally i hated the crazy lady the most
comment,"You don't think like a machine in a situation like Squid Game. I'm sure many people were in the grey zone and considering whether their values still mattered. I understand your point, in a death game people must kill each other.

I think killing Ali was justified, as it was a direct threat to his life. Not so similar for Saebyeok and lying to his team.",you dont think like a machine in a situation like squid game im sure many people were in the grey zone and considering whether their values still mattered i understand your point in a death game people must kill each other i think killing ali was justified as it was a direct threat to his life not so similar for saebyeok and lying to his team
comment,"Yeah but it is going to be on you to prove that . Like , if you can't prove it at all . Then , you are the one that will go to jail because it was YOUR CHOICE to cut someone's else hand.",yeah but it is going to be on you to prove that like if you cant prove it at all then you are the one that will go to jail because it was your choice to cut someones else hand
comment,">I agree. And what he did to his partner in marbles. Horrible.

His action in marble game is bearable because if he loses he'll be dead. But in the honeycomb game he could have saved his team without risking his like but he chose not to",i agree and what he did to his partner in marbles horrible his action in marble game is bearable because if he loses hell be dead but in the honeycomb game he could have saved his team without risking his like but he chose not to
comment,No real chance of getting seen but I think emotional backlash plays a part of it. He was so likeable until the twist that processing this new hatred feels odd and takes a bit of time. San-Woo was hateable from the very start to the near end.,no real chance of getting seen but i think emotional backlash plays a part of it he was so likeable until the twist that processing this new hatred feels odd and takes a bit of time sanwoo was hateable from the very start to the near end
comment,If they were put in a different circumstance with less financial opportunities in life im convinced many of those wall street types would be thugs and murderers.,if they were put in a different circumstance with less financial opportunities in life im convinced many of those wall street types would be thugs and murderers
comment,Mwah  I love him sm,mwah i love him sm
comment,"Why would they call a vote again and end it tho empty handed ? There was clearly lots of players who either thought they had a good chance of winning/desperately needed the money, or swept up in sunk cost fallacy for getting that far.",why would they call a vote again and end it tho empty handed there was clearly lots of players who either thought they had a good chance of winningdesperately needed the money or swept up in sunk cost fallacy for getting that far
comment,“Don’t hate the player hate the game”.,“don’t hate the player hate the game”
comment,[removed],removed
comment,But they did.  Island girl purposely sacrificed herself so sad-byeok could go be with her brother and get her mom out of the north.   Many people sacrificed themselves in the hunger games so katniss could move on.,but they did island girl purposely sacrificed herself so sadbyeok could go be with her brother and get her mom out of the north many people sacrificed themselves in the hunger games so katniss could move on
comment,"Sang woo was a pos. But he still had a moment of reflection towards the end, unlike the evil mastermind of this whole game who is the reason for people like sang woo to exist.",sang woo was a pos but he still had a moment of reflection towards the end unlike the evil mastermind of this whole game who is the reason for people like sang woo to exist
comment,"I think most people are hypocrites who hate him for what he did. He knew that only one would make it out alive. If you literally have a gun at your head and are about to die, you try to survive.",i think most people are hypocrites who hate him for what he did he knew that only one would make it out alive if you literally have a gun at your head and are about to die you try to survive
comment,"The players are only told ""get through all 6 games to win"". With no information about what the games are it's not a huge stretch for the more optimistic players to think there could be more than one winner.",the players are only told get through all 6 games to win with no information about what the games are its not a huge stretch for the more optimistic players to think there could be more than one winner
comment,The last challenge is what makes it a “last to survive wins” base,the last challenge is what makes it a “last to survive wins” base
