type,text,processed_text
post,"Thoughts on Sang-Woo as a character?

",thoughts on sangwoo as a character
post,"Sang Woo is disgustingly calculative. Why does everyone keep defending him

The rule is ""If you win 6 games, you'll win"", not ""if you are the last one to survive, you'll win"". 

Sang Woo CHOSE to not help his mates in the honeycomb round because he knows that more dead people means more money. That action does not come from survival instinct, it's greed. People trying to argue that his actions are relatable and understandable are sick. If you actively refuse to help others from dying just to get more money, you're a bad person, there is no arguments here.",sang woo is disgustingly calculative why does everyone keep defending him the rule is if you win 6 games youll win not if you are the last one to survive youll win sang woo chose to not help his mates in the honeycomb round because he knows that more dead people means more money that action does not come from survival instinct its greed people trying to argue that his actions are relatable and understandable are sick if you actively refuse to help others from dying just to get more money youre a bad person there is no arguments here
post,"Sang Woo is not evil at all in the game.

At our first time watching Squid Game, most of us would conclude that Sang Woo is a cold hearted bastards who only cares about money. But from my view, if we look closer into his actions and personality. We can hardly say that Sang Woo is evil.

Red Light Green Light:

In this game, Sang Woo came on just like a hero to Gi Hun. When Gi Hun is in shock of the game and being unable to move. Sang Woo saved Gi Hun's life by telling him to hide behind other players to avoid the sniper. None of this proves that Sang Woo is evil. And after the game end when every players  are begging the guards to stop the game and they are being threatened at gun points. Sang Woo mentioned the third clause of the contract which can terminate the game. And we can see that 14 people didn't return to the game. Saying that Sang Woo indirectly saved 14 people.

&#x200B;

Outside the game:  
Here none of his evilness is shown too, he helped Ali when he himself as in terrible debt. He bought Ali the ramen, or noodles and even help him to catch a bus fare, showing that Sang Woo is a friendly person. Sang Woo has high pride, he is so ashamed that he couldn't face his mother nor the police and even tried to kill himself

&#x200B;

Sugar Honeycomb

At the first of the game, Sang Woo didn't tell other's the shape they should all choose which I find strange and I won't even argue cause I find this to be the most out of character thing Sang Woo ever did considered how he always try to help. But a point to add is that he himself do not know what the game is. All he knows from Sae Byeok is that they were melting sugar. What if it was a treat for the guards, what if the game is a fight to the dead games with the umbrella having a gun and the triangle having a bow. We can find that it's hard to blame Sang Woo for not telling his team the shape cause he was trying to spread the risk.

Marbles:

Even though I love Ali and even if i was angry that Sang Woo betrayed him, it's hard to blame Sang Woo. It's a life and death game and Sang Woo has a mother to take care of. How many of us would give up our life to a kind stranger like Ali, all of us will try to save ourself cause that's self preserving. Sang Woo did tricked Ali but he wasnt heartless when he did it. When he was about to walk out of the game stage. We can see the guilt in Sang Woo eye and he was sad, even if tears didn't come out of his eye. Of course if Sang Woo has a way to save both Ali and him, he would've done it but in the marble game, there could only be one winner. Even Gi Hun had to trick the old man to save himself

&#x200B;

Glass Stepping Stone.

Yea he did pushed the glassmaker but he was highly justified. From Sang Woo own words, the glassmaker could've saved everyone but he just looked at them as each died. There was 1 tile left with 20 seconds and if Sang Woo wouldn't do something, they would all die. Gi Hun, Sae Byeok, he took matters in his own hand and pushed the glassmaker but he can see the guilt in his eye after he pushed the glassmaker, if he didn't have shame then he would've jumped right away but no, he had to take some seconds to calm his nerves down. And he saved Gi Hun as he was 1 second away from dying from the glasses. I even have a theory that the glassmaker knew what the correct tile is but he was trying to buy the time until it is almost out to get rid of the rest of the 3 people or at least just 2 of Sae Byeok and Gi Hun, given that he didn't tell that he can tell the difference between the glasses for the players who went first, what will stop him from doing the same to take out some more competitors?

&#x200B;

Killing Sae Byeok

Yea, he did killed Sae Byeok but Gi Hun was going to kill him. Sae Byeok was dying and she was running out of blood. I doubt the workers will treat her as seen from how they just calmly take player 271 body away after 101 killed him after the honeycomb game. Sang Woo helped to take her out of her misery, and even after he killed her. He was in shocked as we can see from his eye. Just like when he killed Ali and the glassmaker. He helped to take her out of her misery and suffering

&#x200B;

Squid game

Sang Woo took the honorable way out, when Gi Hun defeated him and was trying to save him, Sang Woo can finally see Gi Hun kindness and he sacrificed himself so Gi Hun could've get the money knowing he will help Sang Woo's mother and he did. Maybe Gi Hun even gave money to Ali's family offscreen.

&#x200B;

Conclusion

From all of these facts we have seen above. Sang Woo isn't evil in anyway, he did all he could to save himself and he does so with guilt, shame and sadness unlike Deok Su the gangster. We can conclude that Sang Woo is someone who got put in bad situations and had to save himself but he feel shame and isn't sadistic in anyway or have pleasure in his actions.",sang woo is not evil at all in the game at our first time watching squid game most of us would conclude that sang woo is a cold hearted bastards who only cares about money but from my view if we look closer into his actions and personality we can hardly say that sang woo is evil red light green light in this game sang woo came on just like a hero to gi hun when gi hun is in shock of the game and being unable to move sang woo saved gi huns life by telling him to hide behind other players to avoid the sniper none of this proves that sang woo is evil and after the game end when every players are begging the guards to stop the game and they are being threatened at gun points sang woo mentioned the third clause of the contract which can terminate the game and we can see that 14 people didnt return to the game saying that sang woo indirectly saved 14 people x200b outside the game here none of his evilness is shown too he helped ali when he himself as in terrible debt he bought ali the ramen or noodles and even help him to catch a bus fare showing that sang woo is a friendly person sang woo has high pride he is so ashamed that he couldnt face his mother nor the police and even tried to kill himself x200b sugar honeycomb at the first of the game sang woo didnt tell others the shape they should all choose which i find strange and i wont even argue cause i find this to be the most out of character thing sang woo ever did considered how he always try to help but a point to add is that he himself do not know what the game is all he knows from sae byeok is that they were melting sugar what if it was a treat for the guards what if the game is a fight to the dead games with the umbrella having a gun and the triangle having a bow we can find that its hard to blame sang woo for not telling his team the shape cause he was trying to spread the risk marbles even though i love ali and even if i was angry that sang woo betrayed him its hard to blame sang woo its a life and death game and sang woo has a mother to take care of how many of us would give up our life to a kind stranger like ali all of us will try to save ourself cause thats self preserving sang woo did tricked ali but he wasnt heartless when he did it when he was about to walk out of the game stage we can see the guilt in sang woo eye and he was sad even if tears didnt come out of his eye of course if sang woo has a way to save both ali and him he wouldve done it but in the marble game there could only be one winner even gi hun had to trick the old man to save himself x200b glass stepping stone yea he did pushed the glassmaker but he was highly justified from sang woo own words the glassmaker couldve saved everyone but he just looked at them as each died there was 1 tile left with 20 seconds and if sang woo wouldnt do something they would all die gi hun sae byeok he took matters in his own hand and pushed the glassmaker but he can see the guilt in his eye after he pushed the glassmaker if he didnt have shame then he wouldve jumped right away but no he had to take some seconds to calm his nerves down and he saved gi hun as he was 1 second away from dying from the glasses i even have a theory that the glassmaker knew what the correct tile is but he was trying to buy the time until it is almost out to get rid of the rest of the 3 people or at least just 2 of sae byeok and gi hun given that he didnt tell that he can tell the difference between the glasses for the players who went first what will stop him from doing the same to take out some more competitors x200b killing sae byeok yea he did killed sae byeok but gi hun was going to kill him sae byeok was dying and she was running out of blood i doubt the workers will treat her as seen from how they just calmly take player 271 body away after 101 killed him after the honeycomb game sang woo helped to take her out of her misery and even after he killed her he was in shocked as we can see from his eye just like when he killed ali and the glassmaker he helped to take her out of her misery and suffering x200b squid game sang woo took the honorable way out when gi hun defeated him and was trying to save him sang woo can finally see gi hun kindness and he sacrificed himself so gi hun couldve get the money knowing he will help sang woos mother and he did maybe gi hun even gave money to alis family offscreen x200b conclusion from all of these facts we have seen above sang woo isnt evil in anyway he did all he could to save himself and he does so with guilt shame and sadness unlike deok su the gangster we can conclude that sang woo is someone who got put in bad situations and had to save himself but he feel shame and isnt sadistic in anyway or have pleasure in his actions
post,"People who are hating on Sang-woo is forgetting one thing…

",people who are hating on sangwoo is forgetting one thing…
post,"I liked Sang-woo

This is late, but it's been laying around my brain, so here it goes. IMO, Sang-woo is the most well-written and my favourite character in Squid Game despite what he did, because I think his storyline can be relatable to most of us.

I interpreted his storyline more as how there are times when morality and ambition are mutually exclusive; like how you can maintain your integrity and fall backwards, or how you can rise to the top and lose your sense of identity. His scenes where he killed Ali and had the knife fight with Gi-hun didn't make me hate him because there were clear displays of guilt. I think it's something relatable to teenagers, working adults and more because there are times when we can screw over others to get what we want. 

I sort of wish he had been the main character instead of Gi-hun too. I think from a strategic standpoint, Sang-woo would have made a better MC only if Squid Game had shifted its original message slightly. From a personal standpoint, Sang-woo would've been better than Gi-hun because, well, my main reason is simply that I don't like Gi-hun: I don't like that he stole money from his mother, advocated against his daughter going to America, and hit the stepfather like he was any better. He was entitled, impulsive, and didn't even get on the plane. 

I know some people will absolutely downvote my post to death because I favour Sang-woo over Gi-hun, but I don't care , I'm willing to hear other opinions though. Granted, what he did was unjustifiable and horrible, but I don't believe that it defines him as a whole. We're more than our mistakes.

EDIT: There's something I'd like to add. I actually think Gi-hun is important to the plot, and I think it would've made him a lot more likable if he were a side character rather than the MC. Gi-hun and Sang-woo are both similar with their intentions, even though they're drastically different with personalities, and that's why I think it was important to include Gi-hun in - he was an idealist who believed being kind and generous would let grant him the win (the person we all wish we could be), whereas Sang-woo was the realist who always had his mind set on the goal (the one we all would be). To be honest, it makes me appreciate Gi-hun and opens my teenage brain a lot more.",i liked sangwoo this is late but its been laying around my brain so here it goes imo sangwoo is the most wellwritten and my favourite character in squid game despite what he did because i think his storyline can be relatable to most of us i interpreted his storyline more as how there are times when morality and ambition are mutually exclusive like how you can maintain your integrity and fall backwards or how you can rise to the top and lose your sense of identity his scenes where he killed ali and had the knife fight with gihun didnt make me hate him because there were clear displays of guilt i think its something relatable to teenagers working adults and more because there are times when we can screw over others to get what we want i sort of wish he had been the main character instead of gihun too i think from a strategic standpoint sangwoo would have made a better mc only if squid game had shifted its original message slightly from a personal standpoint sangwoo wouldve been better than gihun because well my main reason is simply that i dont like gihun i dont like that he stole money from his mother advocated against his daughter going to america and hit the stepfather like he was any better he was entitled impulsive and didnt even get on the plane i know some people will absolutely downvote my post to death because i favour sangwoo over gihun but i dont care im willing to hear other opinions though granted what he did was unjustifiable and horrible but i dont believe that it defines him as a whole were more than our mistakes edit theres something id like to add i actually think gihun is important to the plot and i think it wouldve made him a lot more likable if he were a side character rather than the mc gihun and sangwoo are both similar with their intentions even though theyre drastically different with personalities and thats why i think it was important to include gihun in he was an idealist who believed being kind and generous would let grant him the win the person we all wish we could be whereas sangwoo was the realist who always had his mind set on the goal the one we all would be to be honest it makes me appreciate gihun and opens my teenage brain a lot more
